{
  "protocol_version": "2.0",
  "request_id": "48b8703b-02b7-53fa-b0d1-07c3bb53c9ae",
  "status": "ok",
  "results": [
    {
      "target": {
        "doc_id": "01cfa2b1-5778-5eb4-b54c-bc0b44220926",
        "revision": 1,
        "sha256": "d045f7243b8292d703c49218350c04fa40ab0ecc1e107386625f42e669452314"
      },
      "record": {
        "record_type": "summary",
        "title": "合成会話",
        "conversation_id": "11111111-1111-4111-8111-111111111111",
        "timezone": "Asia/Tokyo",
        "local_date": "2026-09-12"
      },
      "scope_id": "22222222-2222-4222-8222-222222222222",
      "state": "active",
      "source_refs": [
        {
          "doc_id": "5996543a-0f50-51b9-8af7-58ec757d7a6f",
          "revision": 1,
          "sha256": "33d8a0d76e4b9b1b27596e5fa95c1c7892cf3b74b5433b8178f8daad281ef85c",
          "conversation_id": "11111111-1111-4111-8111-111111111111",
          "turn_ids": [
            "55555555-5555-4555-8555-555555555555"
          ],
          "events": [
            {
              "event_id": "44444444-4444-4444-8444-444444444444",
              "event_revision": 1
            }
          ]
        }
      ]
    },
    {
      "target": {
        "doc_id": "5996543a-0f50-51b9-8af7-58ec757d7a6f",
        "revision": 1,
        "sha256": "33d8a0d76e4b9b1b27596e5fa95c1c7892cf3b74b5433b8178f8daad281ef85c"
      },
      "record": {
        "record_type": "conversation",
        "title": "合成会話",
        "conversation_id": "11111111-1111-4111-8111-111111111111",
        "segment_no": 1,
        "timezone": "Asia/Tokyo",
        "local_date": "2026-09-12"
      },
      "scope_id": "22222222-2222-4222-8222-222222222222",
      "state": "active",
      "source_refs": []
    },
    {
      "target": {
        "doc_id": "bcf396a1-7ff1-529a-8c5c-d87504f4028c",
        "revision": 1,
        "sha256": "fbf226078e9a794ccd060abb1049637b91c1b8ebb9262520c6c2292a0a4f5ac9"
      },
      "record": {
        "record_type": "ephy_diary",
        "title": "合成会話",
        "timezone": "Asia/Tokyo",
        "local_date": "2026-09-12"
      },
      "scope_id": "22222222-2222-4222-8222-222222222222",
      "state": "active",
      "source_refs": [
        {
          "doc_id": "5996543a-0f50-51b9-8af7-58ec757d7a6f",
          "revision": 1,
          "sha256": "33d8a0d76e4b9b1b27596e5fa95c1c7892cf3b74b5433b8178f8daad281ef85c",
          "conversation_id": "11111111-1111-4111-8111-111111111111",
          "turn_ids": [
            "55555555-5555-4555-8555-555555555555"
          ],
          "events": [
            {
              "event_id": "44444444-4444-4444-8444-444444444444",
              "event_revision": 1
            }
          ]
        }
      ]
    }
  ]
}
